period,delta_type,brand,channel,actor_type,freshness,engagement_quality,commerce_link,value_for_us,evidence_or_limit,next_action
2026-W27,brand_pool_change,all,all,not_applicable,current_upstream_sync_only,not_applicable,not_applicable,品牌池同步到 33 个品牌；较 W26 简报新增 DJI/Euoto/Ocwqp/Pnitri/RISEOFLE/SelfieShow/TODI/UBeesize/jiangler；未确认退出品牌,新增品牌均来自 ASIN 竞手雷达且暂无站外强证据；P0 仍沿用 yAyusi/Yeaki；TONEOF/SENSYNE/EUCOS 继续作为历史热度复核样本,下周只对新增 watch 品牌做轻量渠道存在性核验
2026-W27,accessible_evidence,yAyusi,TikTok,organic_or_affiliate_unknown,old_2025_content_still_oembed_accessible,engagement_not_returned_by_oembed,commerce_link_not_returned_by_oembed,可继续作为 Amazon Finds/UGC 长尾链路线索；不能当作本周新增热度,TikTok oEmbed 仍可确认 Country Mile 作者和 yAyusi caption；不返回 views/likes/comments/商品卡,下周用可登录浏览器或手动截图补当前互动和商品卡
2026-W27,metric_refresh,yAyusi/Yeaki,YouTube,amazon_affiliate_or_paid_or_affiliate,old_content_current_metric_refreshed,low_incremental_growth,existing_W26_commerce_resolution_only,3 条 YouTube 旧视频刷新到当前高层指标但增量很小；不新增当前成功判断,yAyusi Hoov45 16085→16344 views；yAyusi Best Buys 546→548；Yeaki Product Critiques 575→587；Toolsdoctor 对比样本未返回,下周用浏览器登录态或手动截图补 Yeaki 对比视频和评论
2026-W27,fetch_limit,Yeaki,TikTok,organic_or_affiliate_unknown,no_current_refresh,not_available_from_oembed,commerce_link_not_confirmed,Yeaki 本周仍只保留话术/VOC 样本定位；不提升为表现样本,未获得可核验的新互动/商品卡/评论数据,优先补 Trippin With Trish 或其他 Yeaki 当前截图
2026-W27,action_adjustment,our_brand,all,not_applicable,current_plan,not_applicable,needs_independent_tracking,本周不放大投放；只调整为小样本达人/UGC 招募和归因跟踪,维持 20 个候选/5 个触达/3 个寄样节奏；所有达人链接必须独立记录 final ASIN、coupon、点击和评论问题,下周复盘是否拿到 2 个有效 hook 和 3 个 FAQ/VOC
