period,delta_type,brand,channel,actor_type,freshness,engagement_quality,commerce_link,value_for_us,evidence_or_limit,next_action
2026-W28,brand_pool_change,all,all,not_applicable,current_upstream_sync_only,not_applicable,not_applicable,品牌池仍为 33 个品牌；high 4 个、medium 3 个、watch 26 个；较 W27 未确认新增或退出品牌,上游价格监控源刷新到 2026-07-08；P0 仍沿用 yAyusi/Yeaki；TONEOF/SENSYNE/EUCOS 继续只作历史热度复核样本,下周继续只看 high priority 与历史热度样本的可验证变化
2026-W28,accessible_evidence,yAyusi/Yeaki,TikTok Shop,marketplace_seller_page_not_brand_official,current_search_result_pdp_visible,engagement_not_available_from_search_or_security_check,direct_tiktok_shop_pdp_visible_but_not_full_page_verified,确认两个 P0 品牌存在 TikTok Shop 商品承接面；不能证明品牌官方投放或达人带货成功,搜索结果可见 yAyusi 与 Yeaki TikTok Shop PDP；打开 PDP 进入 security check；Yeaki 片段显示 TechBase 店铺与 0 sold 线索但未能完整核验,用登录浏览器或手动截图补店铺名、价格、sold、评论、商品卡来源
2026-W28,accessible_evidence,Yeaki,YouTube,affiliate_or_comparison_creator_unknown,current_search_result_only,engagement_not_verified,genius_or_amazon_shortlink_candidate,继续作为话术/对比脚本与商品承接线索；不能当本周成功样本,搜索结果出现 Yeaki review/comparison 和 2026 vlogging kit 榜单候选；YouTube 页面打开被限流，未核验播放、评论和披露信息,下周优先打开 2 条 Yeaki YouTube 候选核验 paid/affiliate/ASIN/互动
2026-W28,fetch_limit,yAyusi/Yeaki,TikTok/YouTube,unknown,no_full_refresh,not_available,not_confirmed,本周不新增强证据；结论维持品牌自营弱、affiliate/UGC 长尾为主轴,TikTok 直接访问受 security check/robots 限制；YouTube 详情页出现在线抓取限流；未取得当前互动数、商品卡、评论原文,保留本地 W26/W27 证据为继承基准；只把本周结果记为限制和线索
2026-W28,action_adjustment,our_brand,all,not_applicable,current_plan,not_applicable,needs_independent_tracking,我方动作不放大投放；在达人/UGC 小样本外新增 TikTok Shop 承接面监控字段,继续 20 个候选/5 个触达/3 个寄样节奏；每条内容记录 final ASIN、coupon、点击、评论问题；新增记录 TikTok Shop 店铺、sold、价格、评论和商品卡来源,下周目标是补到 2 条当前互动截图、1 条 TikTok Shop PDP 完整截图、3 个可转 FAQ/VOC
